Line#,Type,PE#,Project#,PE/Project/Accomplishments/Planned Programs Title,BA#,Description,Prior Years,FY 2020,FY 2021,FY 2022 Base,FY 2022 OCO,FY 2022 Total,FY 2023,FY 2024,FY 2025,FY 2026,Program Element,Service
22,PE,0603216F,,Aerospace Propulsion and Power Technology,3,"This program develops and demonstrates technologies to achieve enabling and revolutionary advances in turbine, advanced-cycle, rocket, and space propulsion as well as electrical power, thermal management, and fuels.  The program has six projects, each focusing on technologies with a high potential to enhance the performance of existing and future Air Force weapon systems.  The Aerospace Fuels project develops and demonstrates improved hydrocarbon fuels and advanced propulsion systems, including those for air-breathing, high-speed/hypersonic flight.  The Aerospace Power Technology project develops and demonstrates adaptive power and thermal management components, controls, and systems for high-power payloads and aircraft as part of energy-optimized aircraft development.  The Aircraft Propulsion Subsystems Integration project develops demonstrator engines by integrating the engine cores demonstrated in the Advanced Turbine Engine Gas Generator project with low-pressure components.   The Space and Missile Rocket Propulsion project develops and demonstrates innovative rocket propulsion technologies, propellants, and manufacturing techniques.  The Advanced Aerospace Propulsion project develops the scramjet propulsion cycle to a technology readiness level appropriate for in-flight demonstration and for full integration with other engine cycles (including turbine and rocket based).  The Advanced Turbine Engine Gas Generator project develops and demonstrates core turbine engine technologies for current and future aircraft propulsion systems.  All transfers detailed below are administrative realignments due to the stand up of the United States Space Force, and not new starts. This work will continue to be executed by the Air Force Research Laboratory Aerospace Systems Technology Directorate located in Wright Patterson Air Force Base, OH, Edwards Air Force Base, CA, or Arnold Air Force Base, TN.  In FY 2022, the work and funding associated with advanced space technology demonstrations in PE 0603216F, Aerospace Propulsion, Project 634922, Space & Missile Rocket Propulsion, are transferred to Appropriation 3620F, Research, Development, Test & Evaluation, Space Force, PE 1206616SF, Space Advanced Technology Development/Demo, Project 634922, Space & Missile Rocket Propulsion, due to the creation of a new Appropriation for Space Force.  In FY 2022, the work and funding associated with missile rocket propulsion technologies in PE 0603216F, Aerospace Propulsion, are transferred from Project 634922, Space & Missile Rocket Propulsion, to Project 634093, Missile Rocket Propulsion Integ & Demo due to the creation of a new Appropriation for Space Force.  The Department of the Air Force technologies in this program are both enabling and enduring as we invest in maturing emerging technologies that address established mission gaps, and transformational technologies that address integrated enterprise capabilities intended to reshape the future force across air, space, and cyber warfighting domains. Development of transformational operational capabilities through advanced technology solutions focuses on five strategic capabilities: Global Persistent Awareness; Resilient Information Sharing; Rapid, Effective Decision-Making; Complexity, Unpredictability, and Mass; and Speed and Reach of Disruption and Lethality.  This program element may include necessary civilian pay expenses required to manage, execute, and deliver science & technology capabilities. The use of program funds in this PE would be in addition to the civilian pay expenses budgeted in program elements 0601102F, 0602102F, 0602201F, 0602203F, 0602204F, 0602602F, 0602605F, 0602788F, 1206601SF, and 0602298F.  Projects in this program have been coordinated through the Department of Defense (DoD) Science and Technology (S&T) Executive Committee process to harmonize efforts and eliminate duplication.  This program is in Budget Activity 3, Advanced Technology Development because this budget activity includes development of subsystems and components and efforts to integrate subsystems and components into system prototypes for field experiments and/or tests in a simulated environment.",0,161.352,144.229,75.273,0,75.273,0,0,0,0,Aerospace Propulsion and Power Technology,USAF
22,Project,0603216F,635098,Advanced Aerospace Propulsion,3,"This project develops and demonstrates, via ground and flight tests, the scramjet propulsion cycle to a technology readiness level appropriate for full integration with other engine cycles (including turbine and rocket-based) to provide the Air Force with transformational military capabilities. The primary focus is on the hydrocarbon- fueled, scramjet engine. Multi-cycle engines will provide the propulsion systems for possible application to support aircraft and weapon platforms operating up to Mach 7. Efforts include: scramjet flow-path optimization to enable operation over the widest possible range of Mach numbers; active combustion control to assure continuous positive thrust (even during mode transition); robust flame-holding to maintain stability through flow distortions; and maximized volume-to-surface area to minimize the thermal load imposed by the high-speed engine. Thermal management plays a vital role in scramjet and combined cycle engines, including considerations for protecting low speed propulsion systems (e.g., turbine engines) during hypersonic flight.  This project includes the initiation and development of programs addressing DAF capability gaps and provides technologies for transformational future force capabilities. Transformational efforts will be identified through a competitive process and be responsive to DAF design priorities. Selected efforts will be designated as transformational, indicating enterprise-level priority.",0,18.814,20,17.019,0,17.019,0,0,0,0,Aerospace Propulsion and Power Technology,USAF
22,Project,0603216F,63681B,Advanced Turbine Engine Gas Generator,3,"This project develops and demonstrates technology to increase turbine engine operational reliability, durability, mission flexibility, and performance while reducing weight, fuel consumption, and cost of ownership. The objective is to provide continuous evolution of technologies into an advanced gas generator in which the performance, cost, durability, repairability, and maintainability can be assessed in a realistic engine environment. The gas generator, or core, is the basic building block of the engine and nominally consists of a compressor, a combustor, a high-pressure turbine, mechanical systems, and core subsystems. Experimental core engine demonstration validates engineering design tools and enhances rapid, low-risk transition of key engine technologies into engineering development, where they can be applied to derivative and/or new systems. These technologies are applicable to a wide range of military and commercial systems including aircraft, missiles, land combat vehicles, ships, and responsive space launch. Component technologies are demonstrated in a core (sub-engine). This project also assesses the impact of low spool components such as; inlet systems, fans, low pressure turbines, exhaust systems, and system level technologies such as; integrated power generators and thermal management systems on core engine performance, and durability in ground demonstrations of engine cores. The core performances of this project are validated on demonstrator engines in the Aircraft Propulsion Subsystem Integration Project of this program. A portion of this project supports the demonstration of adaptive cycle technologies, which develop component technology for an adaptive cycle engine architecture that provides optimized performance, fuel efficiency, and durability for widely varying mission needs.  This project includes the initiation and development of programs addressing DAF capability gaps and provides technologies for transformational future force capabilities. Transformational efforts will be identified through a competitive process and be responsive to DAF design priorities. Selected efforts will be designated as transformational, indicating enterprise-level priority.",0,38.831,17,20.816,0,20.816,0,0,0,0,Aerospace Propulsion and Power Technology,USAF
22,Project,0603216F,634921,Aircraft Propulsion Subsystems Int,3,"This project develops and demonstrates technology to increase turbine engine operational reliability, durability, mission flexibility, and performance while reducing weight, fuel consumption, and cost of ownership. The Aircraft Propulsion Subsystems Integration (APSI) project includes demonstrator engines for manned systems and efficient small-scale propulsion for remotely piloted aircraft and cruise missile applications. The demonstrator engines integrate the core (high- pressure spool) technology developed under the Versatile Affordable Advanced Turbine Engines (VAATE) project with the engine (low-pressure spool) technology such as fans, turbines, engine controls, mechanical systems, exhaust nozzles, and augmentors. Additionally, this project includes activities to improve propulsion safety and readiness. This project also focuses on integration of inlets, nozzles, engine-to-airframe compatibility, and power and thermal management subsystems technologies. The APSI project provides aircraft with potential for longer range and higher cruise speeds with lower specific fuel consumption, surge power for successful engagements, high sortie rates with reduced maintenance, reduced life cycle cost, and improved survivability, resulting in increased mission effectiveness. Technologies developed are applicable to sustained high-speed vehicles and responsive space launch. The Aircraft Propulsion Subsystems Integration project is focused on improving propulsion capabilities while at the same time reducing the cost of ownership. Anticipated technology advances include turbine engine improvements providing approximately twice the range for a sustained supersonic combat aircraft, doubling the time on station with ten times the power output for surveillance aircraft and propulsion for a high speed supersonic missile with double the range for time sensitive targets. A portion of this project supports the demonstration of adaptive cycle technologies, which develop component technology for an adaptive cycle engine architecture that provides optimized performance, fuel efficiency, high power extraction, integrated thermal management, and durability for widely varying mission needs.  This project includes the initiation and development of programs addressing DAF capability gaps and provides technologies for transformational future force capabilities. Transformational efforts will be identified through a competitive process and be responsive to DAF design priorities. Selected efforts will be designated as transformational, indicating enterprise-level priority.",0,18.016,0,11.61,0,11.61,0,0,0,0,Aerospace Propulsion and Power Technology,USAF
22,Project,0603216F,632480,Aerospace Fuels,3,"This project evaluates and demonstrates improved hydrocarbon fuels, unique special application fuels, alternate fuels and advanced, novel aerospace propulsion technologies for Air Force applications, including high-speed and hypersonic flight and technologies to increase turbine engine operational reliability, durability, mission flexibility, and performance, while reducing weight, fuel consumption, and cost of ownership. The advanced fuel emphasis is on demonstrating new thermally stable, high-heat sink, and controlled chemically reacting fuels for a conventional turbine engine, turbine-based combined cycle engines, and other advanced propulsion systems. The project also evaluates and demonstrates fuel system components that minimize cost, reduce maintenance, and improve performance of future aerospace systems. The advanced propulsion emphasis is on demonstrating concepts for combined cycle, ramjet, and scramjet engines. A portion of this project supports the demonstration of adaptive cycle technologies. This project develops component technology for an adaptive cycle engine architecture that provides optimized performance, fuel efficiency, and durability for widely varying mission needs.  This project includes the initiation and development of programs addressing DAF capability gaps and provides technologies for transformational future force capabilities. Transformational efforts will be identified through a competitive process and be responsive to DAF design priorities. Selected efforts will be designated as transformational, indicating enterprise-level priority.",0,2.386,2.434,0,0,0,0,0,0,0,Aerospace Propulsion and Power Technology,USAF
39,PE,0604004F,,Advanced Engine Development,4,,0,647.85,665.28,123.712,0,123.712,0,0,0,0,Advanced Engine Development,USAF
39,Project,0604004F,643608,Advanced Engine Dev,4,"The Advanced Engine Development Program enables demonstration of advanced turbine engine prototypes. This program is maturing fuel efficient adaptive engine component technologies and reducing associated risk in preparation for next-generation propulsion system development for combat aircraft applications. Adaptive engine technology enables next generation combat aircraft capabilities by combining the efficiency of high bypass turbofans used by commercial airlines with the performance demanded of military fighter engines. This technology has undergone initial development under the auspices of the Air Force Research Laboratory through the Adaptive Versatile Engine Technology (ADVENT) and Adaptive Engine Technology Demonstrator (AETD) programs.  This program element may include necessary emergent or unanticipated civilian pay expenses required to manage, execute, and deliver Advanced Engine Development for emergent or unanticipated weapon system capability. The use of such program funds would be in addition to the civilian pay expenses budgeted in program element 0605831F.  In FY20 $2.578M expended and in FY21 $3.141M is estimated for civilian pay expenses in this program element.  This effort is in Budget Activity 4, Advanced Component Development and Prototypes (ACD&P), because efforts are necessary to evaluate integrated technologies, representative modes or prototype systems in a high fidelity and realistic operating environment.",0,647.85,665.28,123.712,0,123.712,0,0,0,0,Advanced Engine Development,USAF
197,PE,0207268F,,Aircraft Engine Component Improvement Program,7,"The Aircraft Engine Component Improvement Program (CIP) provides the only source of critical sustaining engineering support for in-service Air Force engines to maintain flight safety (highest priority) to correct deficiencies, improve system operational readiness (OR) and reliability & maintainability (R&M), reduce engine Life Cycle Cost (LCC), and sustain engines throughout their service life.  Past investments have reduced warfighter Class A rates and decreased Engine Related Loss of Aircraft (ERLOA)and generated significant returns on investments. Significant new tasks for this year support increasing reliability and maintainability of the B-52 aircraft/TF33 engine, correcting the #1 removal driver for the TF34 engine to achieve LCC of 24M and eliminating a safety concern with cracked header on the F119 engine.  Engine CIP provides the only means to develop/address solutions to safety issues, obsolescence, reliability, availability, maintainability and affordability driven by changes in aircraft operational parameters, missions, usage or age.  It also serves as the primary vehicle implement emerging technology solutions to resolve these issues.   The program starts with government acceptance of the first procurement-funded engine and continues over the engine's life, gradually decreasing to a minimum level (safety/depot repairs) sufficient to keep older engines operational. Engine CIP testing identifies and fixes engine-related problems ahead of operational impacts. R&M related Engine CIP efforts significantly reduce out year Operations and Maintenance (O&M) and spares costs.  This program element may include necessary civilian pay expenses required to manage, execute, and deliver WEAPON SYSTEM capability.  The use of such programs funds would be in addition to the civilian pay expenses budgeted in program element 0605831F.  This program is in Budget Activity 7, Operational System Development because this budget activity includes development efforts to upgrade systems that have been fielded or have received approval for full rate production and anticipate production funding in the current or subsequent fiscal year.",0,108.446,125.666,103.715,0,103.715,0,0,0,0,Aircraft Engine Component Improvement Program,USAF
197,Project,0207268F,671012,Aircraft Engine Component Improvement Program,7,"The Aircraft Engine Component Improvement Program (CIP) provides the only source of critical sustaining engineering support for in-service Air Force engines to maintain flight safety (highest priority) to correct deficiencies, improve system operational readiness (OR) and reliability & maintainability (R&M), reduce engine Life Cycle Cost (LCC), and sustain engines throughout their service life. Engine CIP directly addresses engine related causes to aircraft Non-Mission-Capability rates. Significant new tasks for this year support increasing reliability and maintainability of the B-52 aircraft/TF33 engine, correcting the #1 removal driver for the TF34 engine to achieve LCC of 24M and eliminating a safety concern with cracked header on the F119 engine.  Changes in aircraft operational parameters and/or missions and task missions and tasks accelerating the discovery of new engine issues and the need to resolve issues; Engine CIP provides the only means to develop fixes for these problems. Engine CIP funding is driven by field events and types/maturity of engines, not by the total engine quantity. The program starts with government acceptance of the first procurement-funded engine and continues over the engine's life, gradually decreasing to a minimum level (safety/depot repairs) sufficient to keep older engines operational. Engine CIP testing identifies and fixes engine-related problems ahead of operational impacts. R&M related Engine CIP efforts significantly reduce out year Operations and Maintenance (O&M) and replacement spares costs.  Service-related engine deficiencies occur throughout the engine lifecycle. Given the uncertainty with regard to the number and timing of engine-related deficiencies, it is essential for the USAF to have adequate engineering capability, test capacity to rapidly respond to problems as they occur and absolutely paramount to reach SecDef directed 80% mission capability rate for F-22, F-16, and F-15 aircraft.",0,75.283,98.104,75.754,0,75.754,0,0,0,0,Aircraft Engine Component Improvement Program,USAF
197,Project,0207268F,675365,F135 Aircraft Engine Component Improvement Program,7,"The F135 Aircraft Engine Component Improvement Program (CIP) supports F-35 single-engine fighter propulsion system.  It provides the only source of critical developmental engineering support for the F135 propulsion system.  F135 CIP maintains flight safety (highest priority), corrects service revealed deficiencies, improves system Operational Readiness (OR) and Reliability & Maintainability (R&M), reduces propulsion system Life Cycle Cost (LCC), and sustains the propulsion system throughout its service life. Historically, aircraft systems change missions, tactics, and environment (including new fuels) and meet changing threats throughout their lives.  New technical problems can develop in the propulsion system through actual use and the F135 CIP provides the means to develop fixes for these problems.  F135 CIP funding is driven by field events and type/maturity of the propulsion system, not by the total quantity of engines.  The program starts with government acceptance of the first procurement-funded engine and continues over the propulsion system's life, gradually decreasing to a minimum level (safety/depot repairs) sufficient to keep older engines operational.  F135 CIP, through ""Lead the Fleet"" operational use and accelerated mission testing, identifies and fixes propulsion-related problems ahead of operational impacts.    F135 CIP ensures continued improvements in R&M, which reduce out year support costs.  Historically, R&M related CIP efforts significantly reduce out year O&M and spares costs.",0,33.163,27.562,27.961,0,27.961,0,0,0,0,Aircraft Engine Component Improvement Program,USAF
219,PE,0205633N,,Aviation Improvements,07,"Project 0601 - Common Ground Equipment is a Naval Aviation Project to apply new technology to common support equipment necessary to support multiple aircraft.    Project 0852: Consolidated Automated Support System is a standardized Automated Test Equipment with computer assisted, multi-function capabilities to support the maintenance of aircraft weapons systems and missiles.  Project 1041 - Aircraft Equipment Reliability/Maintainability Improvement  Program is the only Navy program that provides engineering support for in-service out-of-production aircraft equipment, and provides increased readiness at reduced operational and support cost.    Project 1355 -  Aircraft Engine Component Improvement Program  develops reliability and maintainability and safety enhancements for in-service Navy aircraft engines, transmissions, propellers, starters, auxiliary power units, electrical generating systems, fuel systems, fuels, and lubricants.    Project 2269 - The Expeditionary Airfields (EAF) program designs, develops, tests and fields Airfield Light Systems to replace existing obsolete legacy EAF lighting system.  JUSTIFICATION FOR BUDGET ACTIVITY: This program is funded under OPERATIONAL SYSTEMS DEVELOPMENT because it includes development efforts to upgrade systems that have been fielded or have received approval for full rate production and anticipate funding in the current or subsequent fiscal year.",1692.748,118.01,126.371,132.486,0,132.486,0,0,0,0,Aviation Improvements,Navy
219,Project,0205633N,1355,Propulsion and Power Component Improvement Program,7,"The Propulsion and Power (P&P) Component Improvement Program (CIP) provides the only source of critical design and development engineering support to resolve safety, reliability  and maintainability deficiencies of in-service Navy and Marine Corps aircraft propulsion systems. The highest priority issues P&P CIP addresses concern safety-of-flight deficiencies, which account for approximately 80% of P&P CIP efforts. The program also corrects service-revealed deficiencies, improves Operational Readiness and Reliability and Maintainability, and reduces platform Life Cycle Cost. Budgets are allocated across platform-specific teams and multi-platform product support teams based upon long term strategies to achieve  safety and affordable readiness goals; the R-3 exhibit details annual portions of those long-term strategies. P&P CIP tasks have reduced the rate of in-flight aborts, safety incidents, non-mission capable rates, scheduled and unscheduled engine removals, maintenance work hours, and overall cost of ownership. This is accomplished through the maintenance and validation of specification performance, testing to qualify engineering changes, verifying life limits, and improving the inherent reliability of the propulsion and power systems as an integral part of Reliability Centered Maintenance initiatives. Historically, the missions, tactics, and environmental exposure of military aircraft systems change to meet new threats or operational demands, and often result in unforeseen problems, which if not corrected, can cause critical safety/readiness degradation, such as those experienced during OPERATIONS DESERT SHIELD/DESERT STORM, ENDURING FREEDOM, and IRAQI FREEDOM due to sand erosion. In addition, new problems arise through actual fleet deployment and usage of the aircraft. System development programs, while geared to resolve as many problems as possible before deployment, cannot duplicate actual operations or account for the vast array of environmental and usage variables, particularly when aircraft missions vary from those that the aircraft was designed to perform. Therefore, it has been found that P&P CIP can provide an immediate engineering response to these flight-critical problems and accelerated engine testing can avoid potential problems. P&P CIP starts after development and Navy acceptance of the first production article and addresses usage and life problems not covered by warranties. P&P CIP addresses engines, transmissions, propellers, starters, auxiliary power units, electrical generating systems, aircraft wiring, and fuel and lubricant systems. These efforts continue over the system's life, gradually decreasing to a minimum level sufficient to maintain the reliability, and decrease the operating costs, of older inventory. P&P CIP is a highly leveraged and cooperative tri-service program with Foreign Military Sales participation.",1337.285,96.317,109.391,102.757,0,102.757,0,0,0,0,Aviation Improvements,Navy
