Line#,Type,PE#,Project#,PE/Project/Accomplishments/Planned Programs Title,BA#,Description,Prior Years,FY 2020,FY 2021,FY 2022 Base,FY 2022 OCO,FY 2022 Total,FY 2023,FY 2024,FY 2025,FY 2026,Program Element,Service
46,Project,0603465A,AI8,Alternative Concept Engine Advanced Technology,3,"This Project provides demonstration of adaptable, fuel efficient, and high power to weight engine technologies for potential application to Future Vertical Lift platforms. Efforts include development of alternative, adaptive and smart engine technologies to provide improved performance, readiness and affordability across the engine operating envelope for increased operational capability.  Work in this Project is fully coordinated with PE 0602148A (Future Vertical Lift Advanced Technology Development).  The cited work is consistent with the Under Secretary of Defense for Research and Engineering Science and Technology focus areas and the Army Modernization Strategy.  All FY20 adjustments align program financial structure to Army Modernization Priorities in support of the National Defense Strategy.  Work in this Project is performed by the United States (US) Army Futures Command.",0,2.808,2.507,3.828,0,3.828,0,0,0,0,Future Vertical Lift Advanced Technology,Army
196,PE,0607139A,,Improved Turbine Engine Program,07,"Improved Turbine Engine Program (ITEP) develops, tests, qualifies, and integrates the next generation turboshaft engine on Future Attack Reconnaissance Aircraft (FARA), Black Hawk and Apache aircraft.  The Improved Turbine Engine (ITE) replaces the existing T700 engine design originated in the 1970's and meets the operational requirement of 6,000 feet pressure altitude and 95 degrees (6K/95).  The ITE will fit inside the existing engine bays of the Black Hawk and Apache Helicopters and provides a significant power enhancement of up to fifty percent (total of 3,000 class shaft horsepower) with increased fuel efficiency.  Additional benefits include improved design life, enhanced reliability, lower maintenance cost and restored capability lost due to aircraft weight growth without an increase to the logistics footprint.  The program consists of systems engineering and program management, detailed design engineering, design assurance, hardware manufacturing and testing, component and module level development and testing, system level testing and qualification, and platform integration and qualification.  ITEP is postured to accelerate based on General Electric contract incentives and integration.  FY 2020 funding continued the EMD effort initiated in FY 2019, platform/engine integration A-kit development, completion of engine Critical Design Review (CDR), initiation of engine component testing, completion of Apache Integrated Baseline Review (IBR), completion of engine fit check for Apache and Black Hawk platforms, completion of Apache A-Kit Preliminary Design Review (PDR), and completion of the Systems Requirements Review (SRR) for Apache and Black Hawk.  FY 2021 funding completed Apache Incremental Critical Design Review #1 (iCDR), continues the EMD effort, continues engine component testing leading to First Engine To Test (FETT), will complete Black Hawk Integrated Baseline Review (IBR), will complete the Live Fire Test Design Plan, begins Preliminary Flight Rating (PFR) testing, begins physical airframe integration, initiates Apache A-Kit iCDR #2, and initiates Black Hawk A-Kit PDR.  FY 2022 funding will continue PFR testing leading to a Preliminary Flight Rated engine in FY 2023, continues physical airframe integration, and continues Live Fire detailed test planning, completes Apache A-Kit iCDR #2, completes Black Hawk A-Kit PDR, and initiates Black Hawk A-Kit CDR.  FY 2023 funding provides for completion of Black Hawk A-Kit CDR, completion of Live Fire detailed test planning, initiation of work to prepare for Live Fire static engine tests, initiation of aircraft flight/qualification testing for both Apache and Black Hawk, and the initiation of engine full qualification testing.  FY 2024 funding provides for continuation of aircraft flight/qualification testing for both Apache and Black Hawk, completion of Live Fire static engine tests, completion of engine qualification, initiation of work to prepare for the Live Fire dynamic engine tests, and the beginning Low Rate Initial Production (LRIP).  FY 2025 funding provides for completion of Live Fire dynamic engine tests, continuation of flight/qualification for both Black Hawk and Apache, continuation of LRIP, execution of Initial Operational Test and Evaluation (IOTE) for Black Hawk and Apache, beginning engine integration and A-kit development for the H-60V platform, and initiation of work to prepare for the Live Fire platform level testing (as needed).  FY 2026 funding provides for H-60V A-kit CDR, and begins physical airframe integration.",0,197.941,232.159,275.024,0,275.024,0,0,0,0,Improved Turbine Engine Program,Army
196,Project,0607139A,ES6,Improved Turbine Engine Program,7,"Improved Turbine Engine Program (ITEP) develops, tests, qualifies, and integrates the next generation turboshaft engine on Future Attack Reconnaissance Aircraft (FARA), Black Hawk and Apache aircraft.  The Improved Turbine Engine (ITE) replaces the existing T700 engine design originated in the 1970's and meets the operational requirement of 6,000 feet pressure altitude and 95 degrees (6K/95).  The ITE will fit inside the existing engine bays of the Black Hawk and Apache Helicopters and provides a significant power enhancement of up to fifty percent (total of 3,000 class shaft horsepower) with increased fuel efficiency.  Additional benefits include improved design life, enhanced reliability, lower maintenance cost and restored capability lost due to aircraft weight growth without an increase to the logistics footprint.  The program consists of systems engineering and program management, detailed design engineering, design assurance, hardware manufacturing and testing, component and module level development and testing, system level testing and qualification, and platform integration and qualification.  ITEP is postured to accelerate based on General Electric contract incentives and integration.  FY 2020 funding continued the EMD effort initiated in FY 2019, platform/engine integration A-kit development, completion of engine Critical Design Review (CDR), initiation of engine component testing, completion of Apache Integrated Baseline Review (IBR), completion of engine fit check for Apache and Black Hawk platforms, completion of Apache A-Kit Preliminary Design Review (PDR), and completion of the Systems Requirements Review (SRR) for Apache and Black Hawk.  FY 2021 funding completed Apache Incremental Critical Design Review #1 (iCDR), continues the EMD effort, continues engine component testing leading to First Engine To Test (FETT), will complete Black Hawk Integrated Baseline Review (IBR), will complete the Live Fire Test Design Plan, begins Preliminary Flight Rating (PFR) testing, begins physical airframe integration, initiates Apache A-Kit iCDR #2, and initiates Black Hawk A-Kit PDR.  FY 2022 funding will continue PFR testing leading to a Preliminary Flight Rated engine in FY 2023, continues physical airframe integration, and continues Live Fire detailed test planning, completes Apache A-Kit iCDR #2, completes Black Hawk A-Kit PDR, and initiates Black Hawk A-Kit CDR.  FY 2023 funding provides for completion of Black Hawk A-Kit CDR, completion of Live Fire detailed test planning, initiation of work to prepare for Live Fire static engine tests, initiation of aircraft flight/qualification testing for both Apache and Black Hawk, and the initiation of engine full qualification testing.  FY 2024 funding provides for continuation of aircraft flight/qualification testing for both Apache and Black Hawk, completion of Live Fire static engine tests, completion of engine qualification, initiation of work to prepare for the Live Fire dynamic engine tests, and the beginning Low Rate Initial Production (LRIP).  FY 2025 funding provides for completion of Live Fire dynamic engine tests, continuation of flight/qualification for both Black Hawk and Apache, continuation of LRIP, execution of Initial Operational Test and Evaluation (IOTE) for Black Hawk and Apache, beginning engine integration and A-kit development for the H-60V platform, and initiation of work to prepare for the Live Fire platform level testing (as needed).  FY 2026 funding provides for H-60V A-kit CDR, and begins physical airframe integration.",0,197.941,232.159,275.024,0,275.024,0,0,0,0,Improved Turbine Engine Program,Army
209,PE,0203744A,,Aircraft Modifications/Product Improvement Programs,07,"The MQ-1C Gray Eagle provides the Army with an extended range, multi-purpose (ERMP) Unmanned Aircraft System (UAS); capable of executing reconnaissance, security, attack, and intelligence collection missions in the range of military operations (ROMO). Sensors/payloads include an Electro-Optical/Infrared/Laser Designator (EO/IR/LD), Synthetic Aperture Radar/Moving Target Indicator (SAR/MTI), Signals Intelligence (SIGINT), and HELLFIRE missiles; providing a near all-weather mission capability. MQ-1C Gray Eagle is a dedicated, assured, multi-mission UAS fielded to all Army Divisions, Intelligence and Security Command and Army Special Operations Command in support of the commander's warfighting priorities within multi-domain battle operations.  Currently MQ-1C Gray Eagle high fuel efficiency engines are undergoing a propulsion reliability effort which will reduce MQ-1C Gray Eagle Return to Base events and decrease the likelihood of engine related aircraft mishaps.  This modernization effort will increase operational readiness and posture Gray Eagle to support multi-domain.",0,8.896,11.261,0,0,0,0,0,0,0,MQ-1C Gray Eagle MODS,Army
209,Project,0203744A,EB6,MQ-1C Gray Eagle MODS,7,"The MQ-1C Gray Eagle provides the Army with an extended range, multi-purpose (ERMP) Unmanned Aircraft System (UAS); capable of executing reconnaissance, security, attack, and intelligence collection missions in the range of military operations (ROMO). Sensors/payloads include an Electro-Optical/Infrared/Laser Designator (EO/IR/LD), Synthetic Aperture Radar/Moving Target Indicator (SAR/MTI), Signals Intelligence (SIGINT), and HELLFIRE missiles; providing a near all-weather mission capability. MQ-1C Gray Eagle is a dedicated, assured, multi-mission UAS fielded to all Army Divisions, Intelligence and Security Command and Army Special Operations Command in support of the commander's warfighting priorities within multi-domain battle operations.  Currently the MQ-1C Gray Eagle high fuel efficiency engine is undergoing a propulsion reliability effort, which will reduce MQ-1C Gray Eagle Return to Base events and decrease the likelihood of engine related aircraft mishaps. Additionally, this effort will increase operational readiness for the Operational Commander.",0,8.896,11.261,0,0,0,0,0,0,0,MQ-1C Gray Eagle MODS,Army
210,PE,0203752A,,Aircraft Engine Component Improvement Program,07,"Aircraft Engine Component Improvement Program (CIP) develops, tests, and qualifies improvements to aircraft engine components to correct service-revealed deficiencies, improve flight safety, enhance readiness and reduce operating and support (O&S) costs. In addition, CIP provides the test vehicles for the testing and qualification efforts required as a part of the Army's Critical Safety Item (CSI) program.  Non-program specific Auxiliary Power Unit (APU) as well as Unmanned Aerial Vehicle (UAV) safety and readiness issues are also addressed under this Program Element.",0,0.138,0.08,0.132,0,0.132,0,0,0,0,Aircraft Engine Component Improvement Program,Army
210,Project,0203752A,106,A/C Compon Improv Prog,7,"Aircraft Engine Component Improvement Program (CIP) develops, tests, and qualifies improvements to aircraft engine components to correct service-revealed deficiencies, improve flight safety, enhance readiness and reduce operating and support (O&S) costs. In addition, CIP provides the test vehicles for the testing and qualification efforts required as a part of the Army's Critical Safety Item (CSI) program. Non-program specific Auxiliary Power Unit (APU) as well as Unmanned Aerial Vehicle (UAV) safety and readiness issues are also addressed under this Program Element (PE).",0,0.138,0.08,0.132,0,0.132,0,0,0,0,Aircraft Engine Component Improvement Program,Army
