Line#,Type,PE#,Project#,PE/Project/Accomplishments/Planned Programs Title,BA#,Description,Prior Years,FY 2020,FY 2021,FY 2022 Base,FY 2022 OCO,FY 2022 Total,FY 2023,FY 2024,FY 2025,FY 2026,Program Element,Service
105,PE,0604214M,,AV-8B Aircraft - Engine Dev,05,"The program provides for AV-8B Design, Development, Integration, and Test of various platform improvements such as: Engine Life Management Program (ELMP), Escape Systems, Joint Mission Planning System (JMPS), and Block upgrades to various mission systems and software Operational Flight Programs (OFPs) to include JMPS integration, avionics and communications systems, navigation equipment, weapons carriage and countermeasures, studies and analyses of future capability expansion and unique flight testing, and the Obsolescence Replacement (OR)/Readiness Management Plan (RMP) including structural, hydraulic, electrical, environmental, and mechanical systems.  OR/RMP represents all engineering activities for development and design to support aircraft safety flight clearances, concept explorations, responses to evolving threats, and developments to support Program Objective Memorandum.    The program's Evolutionary Acquisition Strategy includes Design, Development, Integration, and Test activities under the consolidated effort of Block Developments: H6.2 and follow-on block upgrades, to include a H7.0 block upgrade that will be required to implement full Link 16 capability, provide weapon improvements and integrate AIM-9X and Joint Standoff Weapon (JSOW). An H6.2 update included the Common Avionics Program, provided AV-8B a self-contained Global Positioning System navigation capability that is required to access preferred airspaces, including a Litening OFP V3, and initial Link 16 Precise Participant Location and Identification capability, which provided interoperability, digital combat identification and increased situational awareness on the battlefield.  Link 16 is a Top 10 item in the Operational Advisory and Systems Safety Groups.  The H7.0 OFP will fully implement the Harrier Link 16 integration, which will provide information sharing capabilities, integration of an increased number of Link 16 J-series messages and the ability to act on shared target track information.  Connection to the Link 16 network is vital to the AV-8B's ability to operate within some Command and Control situations and Operational Plans, as designed today, as well as provide a tactical capability for the more effective and safe prosecution of both airborne and ground targets. Continued AV-8B combat relevance and ability to respond to evolving and emergent threats through end of service is critical to the Marine Air-Ground Task Force's ability to generate aviation combat power throughout the transition to F-35B. J-series, K-series, Tactical Targeting Network Technology, and other emerging datalink technology messages, as well as compliance with crypto modernization requirements and ability to use GPS-modernized weapons, are required to support current and future mission threats. Linked performance on par with current tactical platforms as well as design to communicate with F-35 is required for the AV-8B to remain tactically relevant to transition. H7.0 will also include the integration and test of weapons and sensors such as, but not limited to, AIM-9X, JSOW and Litening OFP V4, and will integrate required Display Computer processing improvements to enable H7.0 functionality. Integration of these weapons, to include continued use of current weapons as they are upgraded to modernized GPS capability, is vital to the Harrier's continued combat relevance to the Marine Expeditionary Unit and Global Response Force Combatant Commanders particularly as obsolete AIM-9M inventory dwindles.   Additionally, software integration and stores expansion testing will be required for systems to include a Helmet Mounted Cueing System (HMCS), Unique Weapons, survivability and Countermeasures, Second Generation Anti-jam Tactical UHF Radio for NATO (SATURN) communication waveform and associated radio and communication systems upgrades, Advanced Precision Kill Weapons System (APKWS), AIM-9X, ALE-43, survivability upgrades, standoff weapons such as JSOW, Joint Air-to-Ground Missile (JAGM) and AIM-120 unique platform flight test which will be required to utilize updated AIM-120C variants on the AV-8B as well as test of emergent tactical requirements, and test of crypto modernization compliance. AV-8B funding also supports peculiar flight test requirements to include weapons integration/carriage and avionics, software/firmware upgrades, and avionics hardware component redesign activity. Studies and analyses will be conducted on systems such as survivability systems, HMCS, SATURN Communications and associated radio and communication systems upgrades, and Beyond Line of Sight (BLOS) to assess feasibility of integrating on the AV-8B. The ELMP is a comprehensive plan to increase and maintain safety of flight and operational readiness of the AV-8B F402-RR-408 Engine and accessories.  The program will accomplish this mission by conducting Engineering Project Description investigations to develop engineering solutions that address emergent safety, obsolescence, foreign object debris detection and prevention, fatigue life and maintenance issues.  The OR/RMP is required to ensure the AV-8B air vehicle's sustained mission availability, and safe and reliable operational readiness until end of service.  Air vehicle sustainment requires component and system analyses, technical planning, identification, prioritization, and diagnosis of emergent  problems and the allocation of resources for the development, testing and flight clearance of engineering solutions in the areas of flight, crew safety, and escape systems and structural integrity, obsolescence, systems reliability and maintainability, inventory preservation, alternative mission development, or other emergent material or equipment conditions affecting AV-8B systems readiness.  Activities include research/analysis for system safety deficiency corrections, fuel system safety improvements, structural analyses, monitoring and integrity analysis, component compatibility, component and materials obsolescence analyses and mitigation development, explorations for aging equipment, reliability improvement analyses and design developments.",524.857,27.057,16.749,10.146,0,10.146,0,0,0,0,AV-8B Aircraft - Engine Dev,Navy
105,Project,0604214M,0652,AV-8B,5,"This program provides for AV-8B Design, Development, Integration and Test of the following improvements:  Engine Life Management Program (ELMP), Operational Flight Programs (OFPs) and Avionics/Weapons Integration, Escape System, and Readiness Management Plan (RMP). The ELMP is a comprehensive plan to increase safety of flight and operational readiness of the AV-8B F402-RR-408 Engine and Gas Turbine Starter (GTS), as well as other critical engine components. The Program Office will accomplish this mission through the Component Improvement Program (CIP), which entails Engineering Project Description investigations to derive safety and reliability improvements to the engine and engine components. H7.0 OFP will integrate full Harrier Link 16 capability, provide software updates, integrate AIM-9X, a Litening Common OFP update, provide Advanced Precision Kill Weapons System (APKWS) integration improvements, Joint Standoff Weapon (JSOW) integration, and common avionics ADS-B (out), Mode 5, and Mode S Identification Friend or Foe capabilities as well as integrate required Radar Display Computer processing improvements to enable H7.0 functionality.  Other efforts include compliance with crypto modernization requirements, testing compatibility with GPS-modernized weapons, peculiar integration and flight test requirements such as AIM-120C flight test, as AIM-120A/B will become obsolete,  unique weapons, sensors, and countermeasures integration and stores expansion to include APKWS, Helmet Mounted Cueing System (HMCS), Beyond-Line-of-Sight (BLOS) communications, SATURN Communication Waveform and any associated radio/communication systems upgrades, AIM-9X, ALE-43, standoff weapons such as JSOW, and unique flight test, study and component redesign efforts of other avionics, sensors, or weapons systems , or emergent tactical requirements, as they arise. The program is working closely with the Common Avionics Program and the Allies (Spain and Italy) on all efforts. RMP represents all engineering activities for development, design and test to support aircraft safety, flight clearance and concept exploration for resolution of emergent safety, service life, escape systems, compatibility, obsolescence, and readiness issues as well as response to fleet urgent operational requirements.",524.857,27.057,16.749,10.146,0,10.146,0,0,0,0,AV-8B Aircraft - Engine Dev,Navy
114,PE,0604262N,,V-22A,05,"The V-22 Osprey is an Acquisition Category IC Joint Program led by the Department of the Navy for the purpose of developing, testing, evaluating, procuring and fielding a tilt rotor, vertical takeoff and landing aircraft for Joint Service application.  The V-22 program is designed to provide an aircraft to meet the amphibious/vertical assault needs of the Marine Corps, the Carrier Onboard Delivery (COD) needs of the Navy, and the special operations needs of the Air Force and the United States Special Operations Command (USSOCOM). The MV-22 variant replaced the CH-46E in the Marine Corps and the CMV-22 variant will replace the C-2A in the Navy. The CV-22 variant replaced the MH-53J and MH-53M and augments the C-130 in the Air Force and USSOCOM.  The V-22 is capable of flying over 2,100 nautical miles, with a single refueling, giving the services the advantage of a vertical/short take-off and landing aircraft that can rapidly self-deploy to any location in the world.  This program is funded under Engineering Manufacturing and Development (EMD) for correction of deficiencies and includes Block B upgrades which encompassed engineering and manufacturing development of new end-items prior to the production incorporation decision as well as Block C suitability and effectiveness development upgrades. Currently converting all Block B to Block C configuration.  Capability Development Document interoperability requirements were addressed through a spiral upgrade acquisition strategy.  It was the first spiral upgrade providing Key Enabling Department of Defense mandated open systems architecture upgrades for the mission computer hardware and software while simultaneously addressing required interoperability common avionics upgrades and current avionics obsolescence issues.  Future development efforts will include pre-planned-product-improvements in the capability development document and re-design efforts to correct critical Reliability, Maintainability and Availability issues in support of readiness Operational Safety Improvement Program as prioritized by the United States Marine Corps (USMC) or an Urgent Universal Needs Statement.   Note:   The first two CMV production aircraft were test aircraft. They were delivered in January/May 2020 to Patuxent River to support development testing. Operational testing (OT) began in January 2021 and was conducted as part of a carrier air wing work-up prior to deployment. OT is ongoing and focused on assessing the effectiveness and suitability of the CMV-22 as the COD platform in the carrier strike group. There is no Milestone C, because CMV-22 is being executed as an engineering change proposal (ECP) to V-22 Block C. Initial Operational Capability for CMV-22 is 4th Qtr FY 2021.",9616.14,184.443,132.427,107.984,0,107.984,0,0,0,0,V-22A,Navy
114,A/PP,0604262N,1425,V-22 Propulsion / Mission Care Hardware Development,5,,,1.446,2.219,1.849,0,1.849,,,,,V-22A,Navy
199,PE,0604840M,,F-35B C2D2,07,"The F-35 Joint Strike Fighter (JSF) Program will develop and field an affordable, highly common family of next generation strike aircraft for the United States Navy, United States Air Force, United States Marine Corps and International Partners countries. There are three variants the F-35A Conventional Takeoff and Landing variant; F-35B Short Take Off and Vertical Landing; and the F-35C Aircraft Carrier suitable variant. Maximum commonality among the variants, consistent with National Disclosure Policy, will minimize total air system life cycle costs. Planning and pre-development systems engineering for Block 4 continues as Initial Operational Capability (IOC) is met for each variant during System Development and Demonstration (SDD).  The JSF Continuous Capability Development & Delivery (C2D2) efforts provide incremental warfighting capability improvements to maintain joint air dominance against evolving threats. Block 4 capability requirements were initiated through ongoing Service-led operational analysis of warfighting gaps identified in the Fifth Generation Fighter Modernization Initial Capabilities Document (ICD), and through F-35 JSF Block 4 Mission Decomposition analysis completed in FY 2014. These analyses serve as the basis for the Block 4 (CDD), staffed through the Air Force Requirements Oversight Council (AFROC) and signed by the USAF Chief of Staff in January 2015. Joint Requirements Oversight Council (JROC) approved the CDD 21 March 2017. Modernization activities in FY 2017 and FY 2018 include systems engineering, risk reduction, and infrastructure required to deliver full air system Block 4 capabilities to support initial fleet availability of Block 4 upgrades in FY 2020 with the fielding of Auto Ground Collision Avoidance System (AGAS). Modernization activities in FY2021 and FY2022 continue with the incremental releases of Block 4 capabilities.   Block 4 efforts include a robust weapons integration portfolio and provide new opportunities for International Partners to assess, integrate, and field unique capabilities based on global sovereign requirements.  The United Kingdom, Italy, Netherlands, Canada, Australia, Denmark and Norway are participants in F-35 modernization. The program shown here reflects United States Marine Corps funding. Total funding for all Service and International Partners is reported at the accomplishment/planned program level since activities support all aircraft variants. Foreign Military Sales are ongoing separately.  PE 0604840M/N replacing PE 0604810M/N beginning in FY2019 due to budget being moved from BA05 to BA07.",1062.771,380.232,349.879,515.746,0,515.746,0,0,0,0,F-35B C2D2,Navy
199,Project,0604840M,2570,Propulsion (PP),7,"Propulsion F135 Block 4 Integrated Flight Test Support includes efforts such as Engine Flight Test Mechanics, Flight Test Engineers, Replacement Engine Hardware, Test Engine Procurements, and other associated government costs. For C2D2 to be able to continue to test all three aircraft variants, engine propulsion support is required to enable continued flying.  Increased flights and flight hours are planned over the next two years to meet additional Block 4 flight test timelines, requiring elevated propulsion support. All of the current Full Flight Release (FFR) engines supporting Flight Test are at or nearing their life limits, requiring the purchase of new Initial Service Release (ISR) engines to replace them. This replacement effort is planned to occur over the next one to two years to enable continued flight capability. There are additional requirements to support the Air Vehicle modernization efforts in agile software capability improvements, assessing bleed air/weight/thrust/performance capabilities, etc.",0,0,0,16.493,0,16.493,0,0,0,0,F-35B C2D2,Navy
199,A/PP,0604840M,3410,Propulsion (PP),7,,,10.667,11.809,0,0,0,,,,,F-35B C2D2,Navy
200,PE,0604840N,,F-35C C2D2,07,"The F-35 Joint Strike Fighter (JSF) Program will develop and field an affordable, highly common family of next generation strike aircraft for the United States Navy, United States Air Force, United States Marine Corps and International Partners countries. There are three variants the F-35A Conventional Takeoff and Landing variant; F-35B Short Take Off and Vertical Landing; and the F-35C Aircraft Carrier suitable variant. Maximum commonality among the variants, consistent with National Disclosure Policy, will minimize total air system life cycle costs. Planning and pre-development systems engineering for Block 4 continues as Initial Operational Capability (IOC) is met for each variant during System Development and Demonstration (SDD).    The JSF Continuous Capability Development & Delivery(C2D2) efforts provide incremental warfighting capability improvements to maintain joint air dominance against evolving threats. Block 4 capability requirements were initiated through ongoing Service-led operational analysis of warfighting gaps identified in the Fifth Generation Fighter Modernization Initial Capabilities Document (ICD), and through F-35 JSF Block 4 Mission Decomposition analysis completed in FY 2014. These analyses serve as the basis for the Block 4 (CDD), staffed through the Air Force Requirements Oversight Council (AFROC) and signed by the USAF Chief of Staff in January 2015. Joint Requirements Oversight Council (JROC) approved the CDD 21 March 2017. Modernization activities in FY 2017 and FY 2018 include systems engineering, risk reduction, and infrastructure required to deliver full air system Block 4 capabilities to support initial fleet availability of Block 4 upgrades in FY 2020 with the fielding of Auto Ground Collision Avoidance System (AGAS). Modernization activities in FY2021 and FY2022 continue with the incremental releases of Block 4 capabilities.   Block 4 efforts include a robust weapons integration portfolio and provide new opportunities for International Partners to assess, integrate, and field unique capabilities based on global sovereign requirements.  The United Kingdom, Italy, Netherlands, Canada, Australia, Denmark and Norway are participants in F-35 modernization. The program shown here reflects United States Navy funding. Total funding for all Service and International Partners is reported at the accomplishment/planned program level since activities support all aircraft variants. Foreign Military Sales are ongoing separately.  PE 0604840M/N replacing PE 0604810M/N beginning in FY2019 due to budget being moved from BA05 to BA07.",1053.021,342.86,370.235,481.962,0,481.962,0,0,0,0,Propulsion (PP),Navy
200,Project,0604840N,2556,Propulsion (PP),7,"Propulsion F135 Block 4 Integrated Flight Test Support includes efforts such as Engine Flight Test Mechanics, Flight Test Engineers, Replacement Engine Hardware, Test Engine Procurements, and other associated government costs. For C2D2 to be able to continue to test all three aircraft variants, engine propulsion support is required to enable continued flying.  Increased flights and flight hours are planned over the next two years to meet additional Block 4 flight test timelines, requiring elevated propulsion support. All of the current Full Flight Release (FFR) engines supporting Flight Test are at or nearing their life limits, requiring the purchase of new Initial Service Release (ISR) engines to replace them. This replacement effort is planned to occur over the next one to two years to enable continued flight capability. There are additional requirements to support the Air Vehicle modernization efforts in agile software capability improvements, assessing bleed air/weight/thrust/performance capabilities, etc.",0,0,0,16.493,0,16.493,0,0,0,0,Propulsion (PP),Navy
200,A/PP,0604840N,2936,Propulsion (PP),7,,,10.815,12.814,0,0,0,,,,,Propulsion (PP),Navy
1,PE,0601102A,,Defense Research Sciences,01,"This PE builds fundamental scientific knowledge contributing to the sustainment of United States (US) Army scientific and technological superiority in land warfighting capability and to solving military problems related to long-term national security needs, investigates new concepts and technologies for the Army's future force, and provides the means to exploit scientific breakthroughs and avoid technological surprises. This PE fosters innovation in Army niche areas (e.g., lightweight armor, energetic materials, and night vision capability) and areas where there is no commercial investment due to limited markets (e.g., vaccines for tropical diseases). It also focuses university single investigator research on areas of high interest to the Army (e.g., high-density compact power and novel sensor phenomenology). The in-house portion of the program capitalizes on the Army's scientific talent and specialized facilities to transition knowledge and technology into appropriate developmental activities. The extramural program leverages the research efforts of other government agencies, academia, and industry.  This PE also supports basic research at the Army laboratories through the In-House Laboratory Independent Research (ILIR) program.  The ILIR program serves as a catalyst for major technology breakthroughs by providing laboratory directors flexibility in implementing novel research ideas, by nurturing promising young scientists and engineers, and is used to attract and retain top doctoral degreed scientists and engineers. The ILIR program also provides a source of competitive funds for peer reviewed efforts at Army laboratories to stimulate high quality, innovative research with significant opportunity for payoff to Army warfighting capability. This PE also identifies emerging and disruptive basic scientific research outcomes in order to translate, integrate, and ingrain research outcomes with Army Warfighting Concepts which describe how the Army will fight in the far-term future.  The cited work is consistent with the Under Secretary of Defense for Research and Engineering priority focus areas and the Army Modernization Strategy.",0,343.481,344.031,297.241,0,297.241,0,0,0,0,Defense Research Sciences,Army
1,CA,0601102A,T14,"Multi-fuel ignition, chemistry and control strategies for unmanned aircraft systems hybrid propulsion",1,,,9,15,,,,,,,,Defense Research Sciences,Army
15,PE,0602148A,,Future Verticle Lift Technology,02,"This PE conducts air vehicle and mission system component design, fabrication, and evaluation to enable Army Future Vertical Lift. Emphasis is on developing aviation platform and mission system technologies to enhance manned and unmanned air vehicle combat and combat support operations for attack, reconnaissance, air assault, survivability, logistics, and command and control missions.  Work in this PE contributes to the Army Science and Technology (S&T) air systems portfolio and is fully coordinated with efforts in PE 0603465A (Future Vertical Lift Advanced Technology Development), PE 0602183A Air Platform Applied Research and PE 0603043A Air Platform Advanced Technology  The cited work is consistent with the Under Secretary of Defense for Research and Engineering S&T focus areas and the Army Modernization Strategy.  Work in this PE is performed by the United States Army Futures Command (AFC) and the Army Engineering Research and Development Center (ERDC).",0,94.888,169.536,91.411,0,91.411,0,0,0,0,Future Verticle Lift Technology,Army
15,Project,0602148A,AI7,Alternative Concept Engine Technology,2,"This Project develops Future Vertical Lift (FVL) engine component technologies that could significantly improve platform performance, reliability, and operational capability.  Work in this Project is fully coordinated with PE 0603465A (Future Vertical Lift Advanced Technology Development).  The cited work is consistent with the Under Secretary of Defense for Research and Engineering Science and Technology focus areas and the Army Modernization Strategy.  Work in this Project is performed by the United States (US) Army Futures Command.",0,3.507,0,0,0,0,0,0,0,0,Future Verticle Lift Technology,Army
46,PE,0603465A,,Future Vertical Lift Advanced Technology,03,"This PE matures and demonstrates manned and unmanned air vehicle and mission system technologies as well as advanced teaming capabilities to enable Army Future Vertical Lift. Emphasis is on platform and mission system technologies to enhance manned and unmanned air vehicle combat and combat support operations for attack, reconnaissance, air assault, survivability, logistics, and command and control missions. Within this PE, aviation technologies are advanced and integrated into realistic and robust demonstrations.   Work in this PE contributes to the Army Science and Technology (S&T) air systems portfolio and is fully coordinated with efforts in PE 0602148A (Future Vertical Lift Advanced Technology Development), PE 0602183A Air Platform Applied Research and PE 0603043A Air Platform Advanced Technology  The cited work is consistent with the Under Secretary of Defense for Research and Engineering S&T focus areas and the Army Modernization Strategy.   Work in this PE is performed by the United States Army Futures Command (AFC) and the Army Engineering Research and Development Center (ERDC).",0,180.163,220.334,179.677,0,179.677,0,0,0,0,Future Vertical Lift Advanced Technology,Army
